{
  "approval_id": "9b2e4c1a-5d6f-4a7b-8c9d-0e1f2a3b4c5d",
  "incident_id": "4f1c2a9e-7b3d-4e8a-9c1f-2d6b8e0a5c31",
  "run_id": "run-example",
  "decision": "approved",
  "decided_by": "alice",
  "reason": "Matches the deploy timeline; roll back.",
  "decided_at": "2026-10-04T09:03:02Z",
  "action": "{\"kind\": \"revert_change\", \"repo\": \"shop/deploy\", \"commit\": \"fb2edebbff146041aab43b1da7012737c774f6bb\", \"path\": \"services/orders.yaml\", \"title\": \"Roll back orders to 1.3.0\", \"body\": \"Relay, INC-42: orders 1.4.0 throws NullPointerException when no discount code is given.\", \"incident\": \"INC-42\"}",
  "token": "eyJhbGciOiJSUzI1NiJ9.eyJzdWIiOiI5YjJlNGMxYSJ9.c2lnbmF0dXJl"
}
